<commands
	xmlns:xsi="http://www.w3.org/2001/XMLSchema-instance"
	xsi:noNamespaceSchemaLocation="part1in.xsd"
	spatialWidth="1024" spatialHeight="1024">
 <createCity name="x21" x="21" y="0" radius="0" color="black"/>
 <createCity name="x64" x="64" y="0" radius="0" color="black"/>
 <createCity name="x06" x="06" y="0" radius="0" color="black"/>
 <createCity name="x60" x="60" y="0" radius="0" color="black"/>
 <createCity name="x90" x="90" y="0" radius="0" color="black"/>
 <createCity name="x08" x="08" y="0" radius="0" color="black"/>
 <createCity name="x22" x="22" y="0" radius="0" color="black"/>
 <createCity name="x63" x="63" y="0" radius="0" color="black"/>
 <createCity name="x19" x="19" y="0" radius="0" color="black"/>
 <createCity name="x16" x="16" y="0" radius="0" color="black"/>
 <createCity name="x02" x="02" y="0" radius="0" color="black"/>
 <createCity name="x96" x="96" y="0" radius="0" color="black"/>
 <createCity name="x09" x="09" y="0" radius="0" color="black"/>
 <createCity name="x87" x="87" y="0" radius="0" color="black"/>
 <createCity name="x89" x="89" y="0" radius="0" color="black"/>
 <createCity name="x58" x="58" y="0" radius="0" color="black"/>
 <createCity name="x23" x="23" y="0" radius="0" color="black"/>
 <createCity name="x55" x="55" y="0" radius="0" color="black"/>
 <createCity name="x65" x="65" y="0" radius="0" color="black"/>
 <createCity name="x97" x="97" y="0" radius="0" color="black"/>
 <createCity name="x03" x="03" y="0" radius="0" color="black"/>
 <createCity name="x30" x="30" y="0" radius="0" color="black"/>
 <createCity name="x40" x="40" y="0" radius="0" color="black"/>
 <createCity name="x79" x="79" y="0" radius="0" color="black"/>
 <createCity name="x77" x="77" y="0" radius="0" color="black"/>
 <createCity name="x39" x="39" y="0" radius="0" color="black"/>
 <createCity name="x47" x="47" y="0" radius="0" color="black"/>
 <createCity name="x46" x="46" y="0" radius="0" color="black"/>
 <createCity name="x14" x="14" y="0" radius="0" color="black"/>
 <createCity name="x42" x="42" y="0" radius="0" color="black"/>
 <createCity name="x05" x="05" y="0" radius="0" color="black"/>
 <createCity name="x86" x="86" y="0" radius="0" color="black"/>
 <createCity name="x27" x="27" y="0" radius="0" color="black"/>
 <createCity name="x67" x="67" y="0" radius="0" color="black"/>
 <createCity name="x28" x="28" y="0" radius="0" color="black"/>
 <createCity name="x61" x="61" y="0" radius="0" color="black"/>
 <createCity name="x91" x="91" y="0" radius="0" color="black"/>
 <createCity name="x72" x="72" y="0" radius="0" color="black"/>
 <createCity name="x74" x="74" y="0" radius="0" color="black"/>
 <createCity name="x51" x="51" y="0" radius="0" color="black"/>
 <createCity name="x37" x="37" y="0" radius="0" color="black"/>
 <createCity name="x01" x="01" y="0" radius="0" color="black"/>
 <createCity name="x00" x="00" y="0" radius="0" color="black"/>
 <createCity name="x32" x="32" y="0" radius="0" color="black"/>
 <createCity name="x33" x="33" y="0" radius="0" color="black"/>
 <createCity name="x04" x="04" y="0" radius="0" color="black"/>
 <createCity name="x68" x="68" y="0" radius="0" color="black"/>
 <createCity name="x44" x="44" y="0" radius="0" color="black"/>
 <createCity name="x73" x="73" y="0" radius="0" color="black"/>
 <createCity name="x17" x="17" y="0" radius="0" color="black"/>
 <createCity name="x85" x="85" y="0" radius="0" color="black"/>
 <createCity name="x76" x="76" y="0" radius="0" color="black"/>
 <createCity name="x10" x="10" y="0" radius="0" color="black"/>
 <createCity name="x92" x="92" y="0" radius="0" color="black"/>
 <createCity name="x70" x="70" y="0" radius="0" color="black"/>
 <createCity name="x26" x="26" y="0" radius="0" color="black"/>
 <createCity name="x50" x="50" y="0" radius="0" color="black"/>
 <createCity name="x13" x="13" y="0" radius="0" color="black"/>
 <createCity name="x43" x="43" y="0" radius="0" color="black"/>
 <createCity name="x38" x="38" y="0" radius="0" color="black"/>
 <createCity name="x99" x="99" y="0" radius="0" color="black"/>
 <createCity name="x45" x="45" y="0" radius="0" color="black"/>
 <createCity name="x54" x="54" y="0" radius="0" color="black"/>
 <createCity name="x94" x="94" y="0" radius="0" color="black"/>
 <createCity name="x15" x="15" y="0" radius="0" color="black"/>
 <createCity name="x78" x="78" y="0" radius="0" color="black"/>
 <createCity name="x12" x="12" y="0" radius="0" color="black"/>
 <createCity name="x34" x="34" y="0" radius="0" color="black"/>
 <createCity name="x57" x="57" y="0" radius="0" color="black"/>
 <createCity name="x53" x="53" y="0" radius="0" color="black"/>
 <createCity name="x84" x="84" y="0" radius="0" color="black"/>
 <createCity name="x25" x="25" y="0" radius="0" color="black"/>
 <createCity name="x18" x="18" y="0" radius="0" color="black"/>
 <createCity name="x69" x="69" y="0" radius="0" color="black"/>
 <createCity name="x35" x="35" y="0" radius="0" color="black"/>
 <createCity name="x80" x="80" y="0" radius="0" color="black"/>
 <createCity name="x59" x="59" y="0" radius="0" color="black"/>
 <createCity name="x11" x="11" y="0" radius="0" color="black"/>
 <createCity name="x07" x="07" y="0" radius="0" color="black"/>
 <createCity name="x29" x="29" y="0" radius="0" color="black"/>
 <createCity name="x36" x="36" y="0" radius="0" color="black"/>
 <createCity name="x81" x="81" y="0" radius="0" color="black"/>
 <createCity name="x52" x="52" y="0" radius="0" color="black"/>
 <createCity name="x66" x="66" y="0" radius="0" color="black"/>
 <createCity name="x71" x="71" y="0" radius="0" color="black"/>
 <createCity name="x83" x="83" y="0" radius="0" color="black"/>
 <createCity name="x56" x="56" y="0" radius="0" color="black"/>
 <createCity name="x82" x="82" y="0" radius="0" color="black"/>
 <createCity name="x95" x="95" y="0" radius="0" color="black"/>
 <createCity name="x75" x="75" y="0" radius="0" color="black"/>
 <createCity name="x62" x="62" y="0" radius="0" color="black"/>
 <createCity name="x24" x="24" y="0" radius="0" color="black"/>
 <createCity name="x20" x="20" y="0" radius="0" color="black"/>
 <createCity name="x41" x="41" y="0" radius="0" color="black"/>
 <createCity name="x88" x="88" y="0" radius="0" color="black"/>
 <createCity name="x93" x="93" y="0" radius="0" color="black"/>
 <createCity name="x31" x="31" y="0" radius="0" color="black"/>
 <createCity name="x98" x="98" y="0" radius="0" color="black"/>
 <createCity name="x49" x="49" y="0" radius="0" color="black"/>
 <createCity name="x48" x="48" y="0" radius="0" color="black"/>
 <printBinarySearchTree/>
 <printSGTree/>
 </commands>
